name;brand;price;ingredients;rating;sub-category;category;benefit
YOU Radiance Glow Active Night Gel;YOU BEAUTY;Rp93.500;Water, PPG-24-Glycereth-24, Panthenol, Betaine, Propaneaiof, Phenoxyethanof, Hydroxyacetophenone, Niacinamide, Lactobionic Acid, Alfantoin, Carbomer, Triethanolamine, PER-40 Hydrogenated Castor Oil, Soaium Hyaluronate, Disodium EDTA, Pentyfene Glycol, Capryfic/Capric Triglyceride, Propyfene Glycol, Calendufa Officinalis Flower Extract, 4-T-Butyfcycfohexanol, Gfycerin, Butylene Glycol, Cucumis Melo (Melon) Fruit Extract, Gfycine Soja (Soybean) Seed Extract, Coraffina Officinalis Extract, Ascorbyl Tetraisopalmitate, Magnesium Ascorbyl Phosphate, 3-O-Ethyl Ascorbic Acid, Citrus Medica Limonum (Lemon) Peel Oil, Citrus Aurantium Dufcis (Orange) Peel Oil, Citrus Tangerina (Tangerine) Peel Oil, Gentiana Scabra Root Extract, Soaium Lauroyf Lactylate, 1,2-Hexanediol, Prunus Yedoensis Leaf Extract, Ceramide NP, Phytosphingosine, Ceramide AP, Xanthan Gum, Cholesterol, Ethylhexyfgfycerin, Ceramide EOP.;5;Face Gel;Moisturizer;Membantu menghidrasi dan menenangkan kulit, Mencerahkan kulit agar tampak bercahaya di pagi hari, menenangkan sepanjang malam 
Ms Pimple Acne Solution Moisturizing Gel;EMINA;Rp29.200;Aqua, Ethylhexyl methoxycinnamate, Ethylhexyl salicylate, Dipropylene glycol, Trisiloxane, Diethylamino Hydroxybenzoyl Hexyl Benzoate, Polyacrylamide, Acrylates Copolymer, Butylene Glycol, Benzyl Alcohol, Panthenol, Triethanolamine, C13-14 Isoparaffin, Polysorbate 60, Propylene Glycol, Ethylhexylglycerin, Aloe Barbadensis Leaf Extract, Epilobium Angustifolium Flower/Leaf/Stem Extract, Laureth-7, Beta-Glucan, Carbomer, Titanium Dioxide, Tocopheryl Acetate, Cyclopentasiloxane, Phenoxyethanol, Dimethicone Crosspolymer, BHT, Sodium Metabisulfite, Hamamelis Virginiana Leaf Extract, Dimethicone/Vinyl Dimethicone Crosspolymer, Potassium Sorbate, Sodium Benzoate, Tocopherol, Dimethiconol.;4.3;Face Gel;Moisturizer;Membantu mempercepat regenerasi kulit, mencegah pertumbuhan bakteri penyebab jerawat, mengurangi kemerahan pada kulit, mengontrol produksi sebum, mengurangi tampilan kulit berminyak, menjaga kelembaban kulit, serta melindungi kulit dari sinar UV
Light Cloud Gel Cream Moisturizer;KITSCHY;Rp141.750;Squalane, Snail, Sodium Hyaluronate, Ceramide, Tea Tree, Bergamot Oil, Vitamin E, Hydrolyzed Collagen;2.8;Face Gel;Moisturizer;membantu memperbaiki kerusakan kulit dan mengembalikan kekencangan kulit, yang juga dapat mempercantik tampilan kulit yang rawan jerawat. melindungi pelindung kulit dari kerusakan lingkungan. 
Cera-Mug Barrier Moisturizing Gel;WHITELAB;Rp74.150;Ceramide-4, Mugwort, Marine Collagen, dan HyaluComplex-10;4.5;Face Gel;Moisturizer;Melembabkan dan merawat kelembutan kulit wajah, Merawat dan membantu meningkatkan fungsi skin barrier wajah sehingga wajah tampak sehat dan cerah, Mempertahankan level hidrasi kulit wajah, Merawat kekenyalan dan kehalusan kulit wajah, Menyamarkan tanda-tanda penuaan dini pada kulit wajah
Lasting Hydration Gel;FOCALSKIN;Rp95.700;AQUA, GLYCERETH-26, DIPROPYLENE GLYCOL, GLYCERIN, 1,2-HEXANEDIOL, HYDROXYACETOPHENONE, ARGININE, BUTYLENE GLYCOL, ACRYLATES/C10-30 ALKYL ACRYLATE CROSSPOLYMER, CITRUS RETICULATA FRUIT EXTRACT, FUCUS VESICULOSUS EXTRACT, CARBOMER, BETA-GLUCAN, PEG-40 HYDROGENATED CASTOR OIL, PHENOXYETHANOL, DISODIUM EDTA, PARFUM, ETHYLHEXYLGLYCERIN;0;Face Gel;Moisturizer;memberikan kelembaban dan pemulihan untuk kulit. melawan mikroorganisme, merawat kekencangan kulit, kemerahan, atau iritasi. meningkatkan fungsi pelindung kulit. menjaga kelembaban. Mengurangi gatal, rasa gatal, perih, menenangkan, dan meningkatkan ketahanan kulit. Pemulihan multipel: pemulihan dalam kedalaman kulit dan meningkatkan kekebalan kulit. Meremajakan dan menjaga kelembaban, memberikan hidrasi dan kelembutan: tekstur yang ringan dan mudah diserap, memberikan kelembaban dengan cepat.
Aloe Real Cool Soothing Gel;BENTON;Rp78.000;Aloe, Soothing Cooler (Aloe Barbadensis Leaf Extract, Laminaria Japonica Extract, Dioscorea Japonica Root Extract, Ulmus Davidiana Root Extract, Viola Mandshurica Flower Extract);5;Face Gel;Moisturizer;membantu melembabkan kulit. Gel yang memberikan sensasi dingin ini juga dapat membantu menutrisi kulit
Lactic Acid Gel 10% with Alpha Arbutin;FOR SKINS SAKE;Rp154.800;Aqua, Glycolic Acid, Propylene Glycol, Glycerin, Tranexamic Acid, Biosaccharide Gum-1, Polyacrylate Crosspolymer-11, Phenoxyethanol, Saccharide Isomerate, Hydroxyethylcellulose, Allantoin, Bis- PEG-18 Methyl Ether Dimethyl Silane, Panthenol, Triethylene Glycol, Sodium Hyaluronate, Citric Acid, Sodium Citrate;2.8;Face Gel;Moisturizer;mengangkat sel-sel kulit mati. melembabkan , mencerahkan, dan meratakan warna kulit untuk kulit tampak lebih cerah merata, bercahaya, dan plump.
YSB Multi Herbs Hydro Burst Moisturizer;AVOSKIN;Rp141.550;Water, Glycerin, Dipropylene Glycol, Butylene Glycol, 1,2-Hexanediol, Glycereth-26, Sodium Acrylates Crosspolymer-2, Caffeine, Phenoxyethanol, Betaine, Diphenyl Dimethicone, Terminalia Ferdinandiana Fruit Extract, Triethylhexanoin, Hydrogenated Lecithin, Allantoin, Ethylhexylglycerin, Biosaccharide Gum-1, Ceramide NP, Dipotassium Glycyrrhizate, Sucrose Stearate, Silica, Glyceryl Acrylate/Acrylic Acid Copolymer, Melia Azadirachta Flower Extract, Citric Acid, Melia Azadirachta Leaf Extract, Stearic Acid, Palmitic Acid, Ocimum Sanctum Leaf Extract, Curcuma Longa (Turmeric) Root Extract, Coccinia Indica Fruit Extract, Cholesterol, Solanum Melongena (Eggplant) Fruit Extract, Aloe Barbadensis Flower Extract, Corallina Officinalis Extract, Glycosphingolipids, Tocopherol.;5;Face Gel;Moisturizer;membantu melembapkan kulit, menutrisi kulit, dan menenangkan kulit.
VinoHydra Gel Moisturizer;CAUDALIE;Rp495.000;aqua/water/eau, glycerin, vitis vinifera (grape) fruit water, isostearyl isostearate, octyldodecyl myristate, squalane, microcrystalline cellulose, caprylic/capric triglyceride, benzyl alcohol, xanthan gum, carbomer, cellulose gum, caprylyl glycol, vitis vinifera (grape) juice, sodium hyaluronate, sodium hydroxide, aloe barbadensis leaf juice powder, helianthus annuus (sunflower) seed oil, tocopherol, citric acid, dehydroacetic acid, sodium phytate, sodium carboxymethyl beta-glucan, sodium benzoate, potassium sorbate, parfum (fragrance).;0;Face Gel;Moisturizer;memberikan hidrasi natural pada kulit.
Houttuynia Cordata Daily Calming Gel;ALL NATURAL;Rp215.200;Aqua, Dipropylene Glycol, 1,2-Hexanediol, Glycerin, Betaine, Houttuynia Cordata Extract, Acrylates/C10-30 Alkyl Acrylate Crosspolymer, Tromethamine, Ethylhexylglycerin, Polyglyceryl-4 Caprate, Polyglyceryl-6 Caprylate, Polyquaternium-51, Disodium EDTA, Citrus Aurantium Bergamia Fruit Oil, Sodium Hyaluronate, Butylene Glycol, Hydroxypropyltrimonium Hyaluronate, Tocopherol, Hydrolyzed Hyaluronic Acid, Sodium Acetylated Hyaluronate, Centella Asiatica Extract, Portulaca Oleracea Extract, Hyaluronic Acid, Hydrolyzed Sodium Hyaluronate, Sodium Hyaluronate Crosspolymer, Madecassoside, Potassium Hyaluronate, Asiatic Acid, Asiaticoside, Madecassic Acid.;0;Face Gel;Moisturizer;menenangkan (calming) kulit yang teriritasi ringan. menghidrasi dan merawat kelembapan kulit wajah. memberikan kesegaran setelah pemakaian.
Mediheal Aloe Vera Hydrogel (95%);MEDIHEAL;Rp63.200;Aloe Barbadensis Leaf Water, Glycerin, Water, Sodium Hyaluronate Panthenol, Salix Alba (Willow) Bark Extract, Origanum Vulgare Leaf Extract, Chamaecyparis Obtusa Leaf Extract, Lactobacillus/Soybean Ferment Extract, Cinnamomum Cassia Bark Extract, Scutellaria Baicalensis Root Extract, Portulaca, Oleracea Extract, Butylene Glycol, PEG-60 Hydrogenated Castor Oil, Alcohol, Carbomer, Chlorphenesin, Triethanolamine, Phenoxyethanol, Fragrance.;5;Face Gel;Moisturizer;Menghidrasi, menenangkan dan mengembalikan elastisitas kulit, meredakan kulit yang iritasi yang memberikan kelembaban dengan rasa sejuk sehingga membuat kulitmu terhidrasi dan terasa nyaman. mendinginkan, menyegarkan, dan menghidrasi kulit kering, terbakar atau rusak. melindungi kulit dari penghalang kelembapan dan membantu untuk mendorong penyembuhan penyembuhan pada kulit.
Hydrabio Gel-Cr√®me - Hydrating Moisturizer;BIODERMA;Rp256.500;AQUA/WATER/EAU, GLYCERIN, ISODODECANE, CYCLOPENTASILOXANE, DIPROPYLENE GLYCOL, NIACINAMIDE, SQUALANE, POLYMETHYLSILSESQUIOXANE, C14-22 ALCOHOLS, HDI/TRIMETHYLOL HEXYLLACTONE CROSSPOLYMER, AMMONIUM ACRYLOYLDIMETHYLTAURATE/VP COPOLYMER, C30-45 ALKYL CETEARYL DIMETHICONE CROSSPOLYMER, CARBOMER, PENTYLENE GLYCOL, TOCOPHERYL ACETATE, C12-20 ALKYL GLUCOSIDE, STEARETH-21, DISODIUM EDTA, SALICYLIC ACID, SODIUM HYDROXIDE, MANNITOL, XYLITOL, HEXYLDECANOL, PEG/PPG-18/18 DIMETHICONE, RHAMNOSE, MALACHITE EXTRACT, PYRUS MALUS (APPLE) SEED EXTRACT, BRASSICA CAMPESTRIS (RAPESEED) STEROLS, TOCOPHEROL, FRAGRANCE (PARFUM).;4.5;Face Gel;Moisturizer;Menghidrasi secara intens, Menghaluskan tekstur kulit dan mencerahkan kulit, Kulit lebih lembab, Melembabkan dan memberi rasa nyaman pada kulit
Crystallure Superme Advance Hydra Gel;WARDAH;Rp243.000;Aqua, Butylene Glycol, Glycerin, Cyclopentasiloxane, Dimethicone, Triheptanoin, Trehalose, Biosaccharide Gum-1, Ammonium Acryloyldimethyltaurate/VP Copolymer, Phenoxyethanol, Chlorphenesin, Polyglyceryl-3 Methylglucose Distearate, Ectoin, Carbomer, Allantoin, Polysorbate 20, Disodium EDTA, C12-13 Alkyl Glyceryl Hydrolyzed Hyaluronate, Dimethicone/Vinyl Dimethicone Crosspolymer, Sodium Hydroxide, Pentylene Glycol, Sodium Hyaluronate, Amodimethicone, Fragrance, Hydroxyectoin, Hydrolyzed Hyaluronic Acid, Propanediol, Xanthan Gum, Benzyl Alcohol, Glyceryl Caprylate, Benzoic Acid, Palmitoyl Oligopeptide, PEG-40 Hydrogenated Castor Oil, Trideceth-9, Palmitoyl Tetrapeptide-7, Ethylhexylglycerin, Colloidal Gold, Acetyl Heptapeptide-9, CI 19140, CI 17200.;4.8;Face Gel;Moisturizer;Memberikan hidrasi optimal, menjaga kelembaban kulit, membuat kulit kenyal, menghidrasi kulit sepanjang hari, menyamarkan garis halus, menjaga elastisitas kulit, dan membuat wajah tampak lebih muda dan bercahaya.
Whitelab Cera-Mug Barrier Moisturizing Gel;WHITELAB;Rp66.130;Ceramide-4, Mugwort, Marine Collagen,  HyaluComplex-10;4;Face Gel;Moisturizer;Melembabkan dan merawat kelembutan kulit wajah, Merawat dan membantu meningkatkan fungsi skin barrier wajah sehingga wajah tampak sehat dan cerah, Mencegah kekeringan pada wajah, Mempertahankan level hidrasi kulit wajah, Membantu menenangkan kulit yang iritasi dan kemerahan, Merawat kekenyalan dan kehalusan kulit wajah, Menyamarkan tanda-tanda penuaan dini pada kulit wajah
Barrier Complex Moisturizing Gel;TRUEVE;Rp 39.579 - Rp 164.794;Aqua, Cyclopentasiloxane, Glycerin, Niacinamide, Lactobacillus/Hydrolyzed Collagen Ferment Filtrate Extract, Butylene Glycol, Hydrolyzed Elastin, Plukenetia volubilis (Inca Omega) Seed oil, Sodium Lactate, Glycine, Fructose, Sodium PCA, Inositol, Lactic Acid, Urea, Glucosyl Ceramide, Ceramide NP, Ceramide AP, Ceramide EOP, Ceramide NS, Ceramide AS, Copper tripeptide-1, Palmitoyl tripeptide-1, Palmitoyl tetrapeptide-7, Palmitoyl Tripeptide-38, Acetyl hexapeptide-8, Pentapeptide-18, Dipeptide-1, Acetyl tetrapeptide-9, Dipotassium glycyrrhizate, Hyaluronic acid, Hydrolyzed hyaluronic acid, Sodium hyaluronate crosspolymer, Sodium Hyaluronate, Sodium Carboxymethyl Hyaluronate, Sodium acetylated hyaluronate, Potassium Hyaluronate, Hydroxypropyltrimonium hyaluronate, Hydrolyzed Sodium Hyaluronate, Dimethylsilanol Hyaluronate, Beta-glucan, Soluble Collagen, Phenoxyethanol, Carbomer, Sodium polyacrylate, Dicaprylyl carbonate, Polyglyceryl-3 caprate, Panthenol, Polysorbate 20, Tocopheryl Acetate, Triethanolamine, 1,2-hexanediol, Pentylene glycol, Sodium Benzoate, Parfum;4.5;Face Gel;Moisturizer;memperbaiki skin barriernya. menghidrasi kulit serta melindunginya. 
5X Ceramide Barrier Moisture Gel;SKINTIFIC;Rp123.360;AQUA,BUTYLENE GLYCOL,HYDROGENATED POLYISOBUTENE,DIMETHICONE,GLYCERIN,PROPYLENE GLYCOL,1,2-HEXANEDIOL,HYDROXYACETOPHENONE,PEG-400,AMMONIUM ACRYLOYLDIMETHYLTAURATE/VP COPOLYMER,HYDROGENATED LECITHIN,PANTHENOL,PHYTOSTERYL/OCTYLDODECYL LAUROYL GLUTAMATE,CARBOMER,ALLANTOIN,PCA,HYDROXYETHYL ACRYLATE/SODIUM ACRYLOYLDIMETHYL TAURATE COPOLYMER,SQUALANE,CERAMIDE NP,CERAMIDE NS/CERAMIDE NG,CERAMIDE AS,CERAMIDE EOP,CERAMIDE AP,SODIUM HYALURONATE,HYDROLYZED COLLAGEN,CENTELLA ASIATICA EXTRACT,SODIUM HYDROXIDE,HAMAMELIS VIRGINIANA (WITCH HAZEL) EXTRACT,TREHALOSE,ECTOIN,SOPHORA,FLAVESCENS ROOT EXTRACT,OPUNTIA FICUS-INDICA STEM EXTRACT,OPHIOPOGON JAPONICUS ROOT EXTRACT,YEAST POLYSACCHARIDES,PENTYLENE GLYCOL,DISODIUM EDTATOCOPHEROL,POLYSORBATE 60,t-BUTYL ALCOHOL,CITRUS AURANTIUM AMARA (BITTER ORANGE) FLOWER OIL,SORBITAN ISOSTEARATE,CITRUS AURANTIUM BERGAMIA (BERGAMOT) FRUIT OIL,CITRUS MEDICA LIMONUM (LEMON) PEEL OIL;5;Face Gel;Moisturizer;merawat permasalahan skin barrier seperti jerawat, kemerahan, kulit bertekstur, dan juga kulit kering. melembabkan secara mendalam dan memperkuat lapisan epidermis kulit. membantu untuk menjaga dan melindungi skin barrier dengan menjaga kelembaban dan melindungi kulit dari faktor eksternal.
Natura Pal Gel Moisturizer;EMINA;Rp39.900;Aqua, Cyclopentasiloxane, Niacinamide, Glycerin, Ammonium Acryloyldimethyltaurate/VP Copolymer, Dimethicone, Phenoxyethanol, Polyglyceryl-3 Methylglucose Distearate, Propanediol, Allantoin, Polysorbate 20, Chlorphenesin, Carbomer, Tocopheryl Acetate, Disodium EDTA, Potassium Hydroxide, Dimethicone/Vinyl Dimethicone Crosspolymer, Sodium Hyaluronate, Cyclodextrin, Pisum Sativum Extract, Fragrance, Artemisia Capillaris Flower Extract;5;Face Gel;Moisturizer;menghidrasi kulit dua kali lebih baik, memberikan kelembapan instan, dan melindungi kulit dari efek buruk radikal bebas. membantu kulit tampak glowing dan kenyal, cocok untuk semua jenis kulit, serta tidak menyumbat pori-pori atau memicu jerawat
Hydra Rose Dewy Aqua Day Gel;WARDAH;Rp 52.500 - Rp 111.000;Water, Glycerin, Cyclopentasiloxane, Triheptanoin, Butylene Glycol, Trehalose, Biosaccharide Gum-1, Dimethicone, Beta-Glucan, Ammonium Acryloyldimethyltaurate/?VP Copolymer, Saccharide Isomerate, Bisabolol, Brassica Campestris (Rasepeed) Seed Oil, Polyglyceryl-3 Methylglucose Distearate, Phenoxyethanol, Polysorbate 20, Carbomer, Disodium EDTA, Chlorphenesin, Silica, Tocopheryl Acetate, Potassium Hydroxide, Sodium Hyaluronate, Dimethicone/?Vinyl Dimethicone Crosspolymer, Pentylene Glycol, Rose Extract, Propanediol, Amodimethicone, Sodium Hydroxide, Fragrance, Citric Acid, Sodium Citrate, PEG-32, Diazolidinyl Urea, Tocopherol, Trideceth-9, PEG-40 Hydrogenated Castor Oil, Ethylhexylglycerin, Ci 17200, Ci 19140;3.8;Face Gel;Moisturizer;menghidrasi serta menjaga kelembapan kulit. terhidrasi sepanjang hari. 
The Origin Deep Ocean Gel Comforter;KLAVUU;Rp270.000;Water, Dipropylene Glycol, Butylene Glycol, Propanediol, Glycereth-26, Betaine, 1,2-Hexanediol, Glycerin, Hexylene Glycol, Hydroxyacetophenone, Sodium Carbomer, Trehalose, Polyglyceryl-10 Myristate, Polyglyceryl-10 Laurate, Sea Water, Panthenol, Methyl Diisopropyl Propionamide, Disodium EDTA, Sodium Hyaluronate, Beta-Glucan, Melia Azadirachta Leaf Extract, Houttuynia cordata Extract, Chondrus Crispus Extract, Maltodextrin, Melia Azadirachta Flower Extract, Hydrolyzed Vegetable Protein, Chlorella Vulgaris Extract, Hizikia Fusiforme Extract, Undaria Pinnatifida Extract, Laminaria Japonica Extract, Gelidium Cartilagineum Extract, Hydrolyzed Gardenia Florida Extract, Sea Salt, Cynanchum Atratum Extract;3.8;Face Gel;Moisturizer;menenangkan kulit dan memberikan efek dingin secara instan, melemababkan dan membentuk moisture barrier pada kulit. memberikan kenyamanan ekstra pada kulit. Wajah menjadi lembab, kenyal dan segar.
Masque Hydratation Intense;EMBRYOLISSE;Rp308.700;White water lily, Mineral rich marine water, Hyaluronic acid;0;Face Gel;Moisturizer;menghidrasi kulit bahkan pada kulit yang paling kering sekalipun. menghaluskan dan membuat kulit terasa kenyal sehingga membuat garis-garis halus dan kerutan wajah memudar, sangat menyegarkan, Menghidrasi Kulit secara Instan
Peeling Gel;PYUNKANG YUL;Rp132.000;Water, Propylene Glycol, Carbomer, 1,2-Hexanediol, Betaine Salicylate, Quaternium-60, Allantoin, Disodium EDTA, Hydroxyethyl Urea;4.8;Face Gel;Moisturizer;Melembapkan kulit, mengangkat sel kulit mati dengan lembut, mencerahkan dan membersihkan kulit, memperkuat skin barrier, menenangkan kulit yang teriritasi, serta mengatasi kulit kering dan menumpuknya sel kulit mati.
Advance Brightening Gel;TRUEVE;Rp 42.344 - Rp 183.201;Aqua, Methyl Propanediol, Butylene Glycol, Cystoseira tamariscifolia extract, Ascorbyl Tetraisopalmitate, Licorice (Glycyrrhiza glabra) Extract, Glycerin, Sodium Lactate, Glycine, Fructose, Sodium PCA, Inositol, Lactic Acid, Urea, Niacinamide, Glucosyl Ceramide, Ceramide NP, Ceramide AP, Ceramide EOP, Ceramide NS, Ceramide AS, Hyaluronic acid, Hydrolyzed hyaluronic acid, Sodium Hyaluronate Crosspolymer, Sodium Hyaluronate, Sodium Carboxymethyl Hyaluronate, Sodium Acetylated Hyaluronate, Potassium Hyaluronate, Hydroxypropyltrimonium Hyaluronate, Hydrolyzed Sodium Hyaluronate, Dimethylsilanol Hyaluronate, Soluble Collagen, Phenoxyethanol, Carbomer, Triethanolamine, Panthenol, PEG-40 Hydrogenated Castor Oil, Dipotassium glycyrrhizate, Tocopheryl Acetate, Sodium Benzoate, 1,2-Hexanediol, Pentylene Glycol, Parfum;5;Face Gel;Moisturizer;Menghidrasi kulit hingga 48 jam, mencerahkan dan meratakan warna kulit, membantu menghilangkan bekas jerawat, mengencangkan kulit, menyamarkan garis halus, memperbaiki dan memperkuat skin barrier
Tremella Daily Hydrating Gel;BLP BEAUTY;Rp71.600;Aqua, Glycerin, Butylene Glycol, Isononyl Isononanoate, Niacinamide, Squalane, Acrylates/Beheneth-25 Methacrylate Copolymer, Propylheptyl Caprylate, Tremella Fuciformis Polysaccharide, Panthenol, Marrubium Vulgare Extract, Ceramide 3, Dipotassium Glycyrrhizate, Hydrogenated Lecithin, Hydroxyethyl Acrylate/Sodium Acryloydimethyl Taurate Copolymer, Phenoxyethanol, Glyceryl Stearate, PEG-100 Stearate, Tromethamine, Chlorphenesin, Disodium EDTA, Fragrance, Cholestrol, Caprylic/Capric Triglyceride, Deoxphytantriyl, Palmitamide MEA;4.8;Face Gel;Moisturizer;Melembabkan dan menghidrasi kulit serta membantu mengatasi tampilan kulit yang kusam akibat penumpukan sel-sel kulit mati. membantu merawat skin barrier sekaligus membantu memperkuat elastisitas kulit. membantu membuat pori-pori tampak lebih kecil serta membuat kulit terasa lebih lembut dan halus.
Soothing & Moisture Aloe Vera 92% Soothing Gel;NATURE REPUBLIC;Rp79.000;Aloe Barbadensis Leaf Extract, Alcohol, Water, Dipropylene Glycol, Glycerin, Butylene Glycol, Carbomer, PEG-60 Hydrogenated Castor Oil, Propylene Glycol, Triethanolamine, 1,2-Hexanediol, Betaine, Phenoxyethanol, Fragrance, Disodium EDTA, Glyceryl Polyacrylate, Sodium Hyaluronate, Polyglutamic Acid, Mentha Viridis Extract, Calendula Officinalis Flower Extract, Melissa Officinalis Extract.;5;Face Gel;Moisturizer;memberikan nuansa menyegarkan pada kulit, Memberikan efek menenangkan dan melembabkan pada kulit sensitif dan normal, Membuat kulit sehat, Menjaga permukaan wajah dan tubuh sehat
Centella Allantoin Soothing Gel Moisturizer;GLAD2GLOW;Rp 31.000 - Rp 65.000;AQUA, CENTELLA ASIATICA LEAF EXTRACT, METHYL GLUCETH-10, PROPYLENE GLYCOL, BUTYLENE GLYCOL, 1,2-HEXANEDIOL, HYDROXYACETOPHENONE, ACRYLATES/C10-30 ALKYL ACRYLATE CROSSPOLYMER, GLYCERIN, ALLANTOIN, AMINOMETHYL PROPANOL, PENTYLENE GLYCOL, HAMAMELIS VIRGINIANA (WITCH HAZEL) EXTRACT, GENTIANA SCABRA ROOT EXTRACT, MENTHYL LACTATE, ETHYL MENTHANE CARBOXAMIDE, HYDROXYPHENYL PROPAMIDOBENZOIC ACID, PANTHENOL, ROYAL JELLY, CASTANEA SATIVA (CHESTNUT) SEED EXTRACT, HELIANTHUS ANNUUS (SUNFLOWER) SEED EXTRACT, VIOLA TRICOLOR EXTRACT, GLYCYRRHIZA INFLATA ROOT EXTRACT, SALIX ALBA (WILLOW) BARK EXTRACT, SCUTELLARIA BAICALENSIS ROOT EXTRACT, SEA WATER, GLYCINE SOJA (SOYBEAN) SEED EXTRACT, SECALE CEREALE (RYE) SEED EXTRACT, ECTOIN, SOPHORA FLAVESCENS ROOT EXTRACT, FOMES OFFICINALIS (MUSHROOM) EXTRACT, PYRUS CYDONIA SEED EXTRACT, HIBISCUS ABELMOSCHUS SEED EXTRACT, ASCORBYL PALMITATE, PANICUM MILIACEUM (MILLET) SEED EXTRACT, PEG-40 HYDROGENATED CASTOR OIL, PPG-26-BUTETH-26, DISODIUM EDTA, METHYL DIISOPROPYL PROPIONAMIDE, CAPRYLYL GLYCOL, PARFUM, BIS-ETHOXYDIGLYCOL CYCLOHEXANE 1,4-DICARBOXYLATE, XANTHAN GUM;5;Face Gel;Moisturizer;menenangkan kulit, memberikan hidrasi yang cukup, Menenangkan kulit, Membantu merawat kemerahan,èMenjaga hidrasi dan kelembapan kulit, Menenangkan kulit dan membantu merawat kulit berjerawat, Memberikan hidrasi yang diperlukan kulit dan menjaga kelembaban
Glo Rad+ 9-Hyalucica Glow Moisture Gel;EMINA;Rp94.900;Aqua, Niacinamide, Dipropylene Glycol, Betaine, Butylene Glycol, Methyl Gluceth-20 Phenoxyethanol, Carbomer, Polyacrylate Crosspolymer-11, Cholesteryl isostearate, Potassium Hydroxide, Chlorphenesin, Cholesteryl Chloride, Cholesteryl Nonanoate, Centella Asiatica Extract,Allantoin, Disodium EDTA, Scutellaria Baicalensis Root Extract, Polygonum Cuspidatum Root Extract, Camellia Sinensis Leaf Extract, Glycyrrhiza Glabra (Licorice) Root Extract, Chamomilla Recutita (Matricaria) Flower Extract, Rosmarinus Officinalis (Rosemary) Leaf Extract, Biosaccharide Gum-2,Glycerin, Hydrolyzed Hyaluronic Acid, Pentylene Glycol, Beta-Glucan, Alpha- Arbutin, Caprylyl Glycol, Fragrance, Sodium Chloride, Sodium Metabisulfite, Tranexamic Acid, Sodium Citrate, Silica Dimothyl Silylate, Citric Acid, Aminopropyl Ascorbyl Phosphate, Geranium Robertianum Extract, Paeonia Suffruticosa Root Extract, Thymus Serpyllum Extract, Alpinia Katsumadai Seed Extract, Glutathione, Lecithin, Ferulic Acid, Hydroxyethylcellu- lose, Laurdimonium Hydroxypropyl Hydrolyzed Soy Protein, Polysorbate 20, PEG-35 Castor Oil, PEG-40 Hydrogenated Castor Oil, Tocopheryl Acetate.;4.8;Face Gel;Moisturizer;menenangkan kulit, mengunci dan melembabkan barrier, menghaluskan tekstur kulit, mencerahkan, mengurangi kemerahan kulit, menjaga skin barrier, 
Brightening Moisturizer;THE ORIGINOTE;Rp52.800;Water, glycerin, butylene glycol, aloe barbadensis leaf water, niacinamide, glycosyl trehalose, hydrogenated starch hydrolysate, hydroxyacetophenone, 1,2-hexanediol, cetearyl alcohol, bellis perennis (daisy) flower extract, diglycerin, PEG/PPG-17/6 copolymer, tranexamic acid, acrylates/C10-30 alkyl acrylate crosspolymer, cetearyl glucoside, arginine, ammonium acryloyldimethyltaurate/VP copolymer, sorbitan olivate, alpha-arbutin, allantoin, glyceryl glucoside, glycyrrhiza uralensis (licorice) root extract, portulaca oleracea flower/leaf/stem extract, paeonia suffruticosa root extract, paeonia lactiflora extract, polysorbate 80, glucose, sorbitan oleate, caprylic/capric triglyceride, camellia sinensis extract, fragaria ananassa (strawberry) fruit extract, phenylethyl resorcinol, phenoxyethanol, phospholipids, ananas sativus (pineapple) fruit extract, potassium sorbate, sodium benzoate, carica papaya (papaya) fruit extract, ceramide NP, ceramide EOP, ceramide AS, ceramide AP, ceramide NS, ethylhexylglycerin, tocopheryl acetate;3;Face Gel;Moisturizer;membantu menjaga hidrasi kulit, mencegah tanda-tanda penuaan dini dengan menjaga kelembapan kulit. Mencerahkan dan meratakan warna kulit. Mencerahkan dan meratakan warna kulit. Membantu menjaga hidrasi kulit, mencegah tanda-tanda penuaan dini dengan menjaga kelembapan kulit. Membantu mengenyalkan kulit dan menjaga keremajaan kulit
5% Panthenol Acne Calming Water Gel;SKINTIFIC;Rp 107.940 - Rp 215.735;WATER, PANTHENOL, METHYL GLUCETH-20, DIPROPYLENE GLYCOL, CENTELLA ASIATICA EXTRACT, CALENDULA OFFICINALIS EXTRACT, AVENA SATIVA (OAT) KERNEL EXTRACT, PHAEODACTYLUM TRICORNUTUM EXTRACT CHLORELLA VULGARIS EXTRACT, PENTYLENE GLYCOL, ACRYLATES/C10-30 ALKYL ACRYLATE CROSSPOLYMER, TROMETHAMINE, 1,2-HEXANEDIOL, CERAMIDE NP, CERAMIDE AS, CERAMIDE NS/CERAMIDE NG, CERAMIDE AP, CERAMIDE EOP, BUTYLENE GLYCOL, GLYCEROPHOSPHOINOSITOL CHOLINE, GLYCERIN, AMMONIUM ACRYLOYLDIMETHYLTAURATE/VP COPOLYMER, HYDROGENATED LECITHIN, ECTOIN, TOCOPHEROL, PENTASODIUM PENTETATE, ERYTHRITOL, PROPANEDIOL, PHYTIC ACID, SILVER OXIDE, DIETHOXYETHYL SUCCINATE, HYDROXYPHENYL PROPAMIDOBENZOIC ACID, LECITHIN, SODIUM ASCORBATE, ASCORBYL PALMITATE;5;Face Gel;Moisturizer;memberikan sensasi cooling yang menenangkan kulit. membantu meredakan kemerahan dan menenangkan kulit berjerawat. membantu mengontrol minyak.
Hyalucera Moisturizer;THE ORIGINOTE;Rp43.890;Water, glycerin, butylene glycol, glycereth-26, 1,2-hexanediol, hydroxyacetophenone, acrylates/c10-30 alkyl acrylate crosspolymer, panthenol, hydroxyethylpiperazine ethane sulfonic acid, diglycerin, propylene glycol, triethanolamine, methylpropanediol, sodium hyaluronate, allantoin, glucose, sophora angustifolia root extract, stephania tetrandra extract, hydrolyzed hyaluronic acid, cnidium monnieri fruit extract, glycyrrhiza uralensis (licorice) root extract, phellodendron amurense bark extract, phenoxyethanol, caprylic/capric triglyceride, chlorella vulgaris extract, spirulina platensis extract, hydrogenated lecithin, chlorphenesin, hexylene glycol, stearic acid, cholesterol, ceramide NP;5;Face Gel;Moisturizer;menjaga dan memperbaiki skin barrier, mengunci hidrasi di dalam kulit, serta mempertahankan elastisitas kulit. sebagai antioksidan, membantu mengontrol minyak berlebih, dan menjaga elastisitas kulit.
