name;brand;price;ingredients;rating;sub-category;category;benefit
Cherry Blossom Jelly Cream 50ml (21);INNISFREE;Rp267.750;WATER / AQUA / EAU, DIPROPYLENE GLYCOL, NIACINAMIDE, BETAINE, 1,2-HEXANEDIOL, CARBOMER, TROMETHAMINE, FRAGRANCE / PARFUM, AMMONIUM ACRYLOYLDIMETHYLTAURATE/BEHENETH-25 METHACRYLATE CROSSPOLYMER, DISODIUM EDTA, ETHYLHEXYLGLYCERIN, PROPANEDIOL, PRUNUS YEDOENSIS LEAF EXTRACT, TOCOPHEROL;5;Face Gel;Moisturizer;memberikan kelembapan melimpah pada kulit kering dan kusam, sehingga kulit tampak lebih segar dan bervitalitas. membantu membuat kulit lebih bersih, cerah, dan bercahaya. menjaga kelembapan kulit dan mencegah dehidrasi tanpa membuatnya kering. memberikan efek pelapisan yang mengunci kelembapan dengan sensasi menyegarkan seperti tetesan air, serta cepat meresap dan membuat kulit tampak berkilau.
Lightening Day Gel;WARDAH;Rp 32.300 - Rp 49.000;Aqua, Niacinamide, Cyclopentasiloxane, Glycerin, Dimethicone, Butylene Glycol, Ethylhexyl Methoxycinnamate, Ammonium Acryloyldimethyltaurate/VP Copolymer, Phenoxyethanol, Butyl Methoxydibenzoylmethane, Polysorbate 20, Carbomer, Disodium EDTA, Allantoin, Chlorphenesin, Silica, Tocopheryl Acetate, Dimethicone/Vinyl Dimethicone Crosspolymer, Pentylene Glycol, Potassium Hydroxide, Fragrance, Amodimethicone, Sodium Hydroxide, Glycyrrhiza Glabra (Licorice) Root Extract, Actinidia Polygama Fruit Extract, Trideceth-9, PEG-40 Hydrogenated Castor Oil, Ethylhexylglycerin, Ci 42090;5;Face Gel;Moisturizer;melembabkan kulit agar tetap segar dan melindungi kulit dari kekusaman.
Pink Bliss Moisturizer;DORSKIN;Rp98.040;Aqua, Niacinamide, Centella Asiatica Extract, Glycerin, Triethanolamine, Petrolatum, Isopropyl Myristate, Punica Granatum Fruit Extract, Carbomer, Propylene Glycol, Aloe Barbadensis Leaf Extract, Cetyl Alcohol, Dimethicone, 1,2- Hexanediol, Cetearyl Alcohol, Pectin, Glyceryl Stearate, Honey Extract, Caprylyl Glycol, Ceteareth-20, Disodium EDTA, PEG-40 Stearate, Acetyl Glucosamine, Arginine, Ascorbic Acid, Calcium Carbonate, Caprylic/Capric Triglyceride, Citric Acid, Glucose, Glutathione, Hydrogenated Lecithin, Hydroxypropyl Methylcellulose, Sodium Chloride, Dmdm Hydantoin, Phenoxyethanol, Benzoic Acid.;5;Face Gel;Moisturizer;melembapkan dan mencerahkan, membantu menenangkan inflamasi.
Pomegranate 5% Niacinamide Brightening Moisturizer;GLAD2GLOW;Rp 35.000 - Rp 79.000;AQUA, GLYCERIN, NIACINAMIDE, BUTYLENE GLYCOL, CAPRYLIC/CAPRIC TRIGLYCERIDE, PUNICA GRANATUM FRUIT EXTRACT, PROPYLENE GLYCOL, AMMONIUM ACRYLOYLDIMETHYLTAURATE/VP COPOLYMER, DIMETHICONE, BETAINE, GLYCERETH-26, ISOPROPYL PALMITATE, 1,2-HEXANEDIOL, HYDROXYACETOPHENONE, CETEARYL ALCOHOL, POLYACRYLATE-13, ALLANTOIN, BUTYROSPERMUM PARKII (SHEA) BUTTER, CENTELLA ASIATICA EXTRACT, DIMETHYL ISOSORBIDE, POLYISOBUTENE, PARFUM, SODIUM HYALURONATE, XANTHAN GUM, HYDROXYPINACOLONE RETINOATE, PENTYLENE GLYCOL, POLYSORBATE 20, SORBITAN ISOSTEARATE, ROSA HYBRID FLOWER EXTRACT, NONAPEPTIDE-1, TETRAPEPTIDE-1, GARDENIA FLORIDA FRUIT EXTRACT, CI 16185.;4.8;Face Gel;Moisturizer;mencerahkan kulit wajah, membuat kulit wajah tampak lebih cerah. Mencerahkan kulit, Membantu meratakan warna kulit, Menjaga kelembaban kulit. Membantu mencerahkan kulit, menyamarkan noda hitam dan meratakan warna kulit, membantu mencerahkan kulit
Fundamental Eye Awakening Gel;DEAR KLAIRS;Rp253.200;Water, Glycerin, 1,2-hexanediol, Butylene Glycol, Propanediol, Argania Spinosa Kernel Oil, Simmondsia Chinensis (Jojoba) Seed Oil, Tocopherol, Caffeine, Phaseolus Angularis Seed Extract, Artemisia Princeps Leaf Extract, Camellia Sinensis Leaf Extract, Chaenomeles Sinensis Fruit Extract, Chrysanthellum Indicum Extract, Cinnamomum Cassia Bark Extract, Diospyros Kaki Leaf Extract, Perilla Frutescens Extract, Portulaca Oleracea Extract, Acetyl Hexapeptide-8, Copper Tripeptide-1, Oligopeptide-29, Oligopeptide-32, Carbomer, Hydroxyethylcellulose, Hydroxyethyl Acrylate/Sodium Acryloyldimethyl Taurate Copolymer, Polyglyceryl-10 Laurate, Sorbitan Isostearate, Caprylyl/Capryl Glucoside, Sodium PCA, Tromethamine, Ethylhexylglycerin;3.3;Face Gel;Moisturizer;menjaga area sekitar matamu tetap bersih dan segar. Dapat membantu mengatasi dark circle dan meratakan warna kulit sambil mengurangi tampilan kantung mata. memberikan sensasi dingin dan melembabkan.
ADARA - Diamond Glycolic All In One Moisturizer;ADARA COSMETICS;Rp67.980;Aqua, Niacinamide, Propanediol, Sodium Polyacryloyldimethyl Taurate, Bis-PEG-18 Methyl Ether Dimethyl Silane, Phenoxyethanol, Potassium Hydroxide, Allantoin, Chlorphenesin, Panthenol, Disodium EDTA, Glycolic Acid, PEG-40 Hydrogenated Castor Oil, 1,2-Hexanediol, Ethyl Ascorbic Acid, Sodium Hyaluronate, Butylene Glycol, Laminaria Digitata Extract, Hyaluronic Acid, Hydrolyzed Hyaluronic Acid, Hydroxypropyltrimonium Hyaluronate, Hydrolyzed Sodium Hyaluronate, Pentylene Glycol, Potassium Hyaluronate, Sodium Hyaluronate Crosspolymer, Sodium Acetylated Hyaluronate, PVP, Cetyl-PG Hydroxyethyl Palmitamide, Ceramide, Ceramide 2, Ceramide 3, Ceramide 4, Ceramide 6 II, Cholesterol, Hydrogenated Lecithin, Xanthan Gum, Benzyl Alcohol, Glyceryl Caprylate, Fullerenes, Benzoic Acid, Acetyl sh-Pentapeptide-35, Diamond Powder.;5;Face Gel;Moisturizer;Memperkuat fungsi skin barrier, Melembutkan kulit, Mencerahkan kulit wajah, Mengangkat sel kulit mati, Mengurangi jerawat ringan hingga sedang, Mengecilkan pori-pori
Sekkisei Herbal Gel;KOSE;Rp621.280;Water, Glycerin, Butylene Glycol, Cetyl Ethylhexanoate, Alcohol, Dipentaerythrityl Hexahydroxystearate/Hexastearate/Hexarosinate, Hydrogenated Lecithin, Dimethicone, Angelica Acutiloba Root Extract, Artemisia Princeps Leaf Extract, Eriobotrya Japonica Leaf Extract, Melothria Heterophylla Root Extract, Saccharomyces/Coix Lacryma-Jobi Ma-yuen Seed Ferment Filtrate, Tocopherol, Acrylates/C10-30 Alkyl Acrylate Crosspolymer, Carbomer, Cholesterol, Disodium EDTA, Phytosteryl Macadamiate, PVP, Sodium Hydroxide, Fragrance.;5;Face Gel;Moisturizer;melembabkan, membuat kulit tampak berseri, meredakan inflamasi dan menciptakan tampilan awet muda yang alami.  
2,5% D-Panthenol Barrier Shield Moisturizer;SCORA;Rp34.320;2.5% D-Panthenol, 1% PhytAura, Aquacacteen, Vitamin E, Bisabolol, Allantoin;5;Face Gel;Moisturizer;Melembabkan kulit secara intensif dan membantu mengurangi kemerahan dan iritasi pada skin barrier, Melembabkan kulit sambil menenangkan kemerahan dan iritasi, Mempertahankan kesehatan alami kulit, Sebagai antioksidan dan untuk menenangkan kulit, Sebagai soothing agent untuk mengurangi kemerahan dan iritasi di kulit, Mengurangi kemerahan dan peradangan
Rose Gel;HAPLE;Rp79.000;Rosa Damascena (Rose) Flower Water, Inositol, Niacinamide, Sodium Pca, Triethanolamine, Carbomer, Panthenol, Phenoxyethanol, Peg-40 Hydrogenated Castor Oil;5;Face Gel;Moisturizer;melembabkan kulit sekaligus mencerahkan wajah. Melembabkan Menghidrasi Mencerahkan Merawat kulit yang mengalami radang kemerahan dan inflamasi
Hydrium Green Tea Aqua Soothing Gel Cream;COSRX;Rp241.500;Water, Propanediol, Camellia Sinensis Leaf Extract, Glycerin, Pentylene Glycol, 1,2-Hexanediol, Acrylates/?C10-30 Alkyl Acrylate Crosspolymer, Tromethamine, Butylene Glycol, Allantoin, Ethylhexylglycerin, Glyceryl Acrylate/?Acrylic Acid Copolymer, Disodium EDTA, Hydrolyzed Hibiscus Esculentus Extract, Moringa Oleifera Seed Oil, Melia Azadirachta Leaf Extract, Melia Azadirachta Flower Extract;4.6;Face Gel;Moisturizer;menghidrasi kulit secara menyeluruh
Ceramide Ato Soothing Gel;ILLIYOON;Rp215.200;Water, Propanediol, Glycerin, Squalane, Caprylic/Capric Triglyceride, Polyglyceryl-3 Methylglucose Distearate, 1,2-Hexanediol, Ammonium Acryloyldimethyltaurate/VP Copolymer, Carbomer, Tromethamine, Glyceryl Caprylate, Ethylhexylglycerin, Betaine, Ceramide NP (100ppm), Tocopherol.;5;Face Gel;Moisturizer;Melembabkan dan menenangkan kulit sensitif. meningkatkan produksi kolagen dalam kulit. -Memberikan perlindungan kelembaban yang tahan lama.
CeraHydro Barrier Moisture Gel;ELFORMULA;Rp112.640;Water, butylene glycol, glycerin, isononyl isononanoate, caprylic/capric triglyceride, isododecane, cyclopentasiloxane, 1,2-hexanediol, hydroxyacetophenone, cetearyl alcohol, diglycerin, carbomer, polysorbate 80, triethanolamine, ectoin, propylene glycol, sodium polyglutamate, sorbitan oleate, bisabolol, sodium hyaluronate, centella asiatica extract, propanediol, glucose, hydrogenated lecithin, polygonum cuspidatum root extract, scutellaria baicalensis root extract, hexylene glycol, stearic acid, cholesterol, ceramide np, camellia sinensis leaf extract, glycyrrhiza glabra (licorice) root extract, beta-glucan, chamomilla recutita (matricaria) flower extract, rosmarinus officinalis (rosemary) leaf extract, lespedeza capitata leaf/stem extract, avena sativa (oat) kernel extract, zingiber officinale (ginger) root extract;5;Face Gel;Moisturizer;Merawat Skin Barrier, memberikan efek nyata pada kulit.
Balancing Gel;PYUNKANG YUL;Rp174.000;Astragalus Membranaceus Root Extract, Polysorbate 80, PEG-150 Distearate, 1,2-Hexanediol, Polysorbate 20, Simmondsia Chinensis (Jojoba) Seed Oil, Glyceryl Caprylate;4;Face Gel;Moisturizer;Membentuk lapisan pelindung pada kulit, memberikan nutrisi, merangsang regenerasi kulit, serta membantu penyerapan yang optimal berkat panas dari tangan
Red Bean Water Gel;BEAUTY OF JOSEON;Rp195.000;Phaseolus angularis seed extract (441,000 ppm), water, butylene glycol, glycerin, 1,2-hexanediol, methyl trimethicone, acrylates/c10-30 alkyl acrylate crosspolymer, tromethamine, glyceryl glucoside, c12-14 alketh-12, maltodextrin, ammonium acryloyldimethyltaurate/vp copolymer, dimethicone/vinyl dimethicone crosspolymer, dimethicone crosspolymer, ethylhexylglycerin, betaine, panthenol, allantoin, dipotassium glycyrrhizate, polyquaternium-51, xanthan gum, disodium edta, glyceryl acrylate/acrylic acid copolymer, dioscorea japonica root extract, glucose, sodium citrate, beta-glucan, hydrolyzed corn starch, citric acid, sucrose, caprylyl glycol, helianthus annuus (sunflower) seed oil, tocopherol, cyanocobalamin, glycine, serine, glutamic acid, magnesium ascorbyl phosphate, aspartic acid, leucine, acetyl hexapeptide-8, alanine, lysine, arginine, tyrosine, phenylalanine, proline, threonine, valine, isoleucine, histidine, cysteine, methionine, sh-oligopeptide-1, sh-oligopeptide-2, sh-polypeptide-1;4;Face Gel;Moisturizer;mengurangi minyak berlebih di wajah, merawat keremajaan kulit, menghidrasi dan menutrisi kulit. Mengurangi sebum berlebih dan merawat elastisitas kulit, Melembabkan kulit dan menjaga kekencangan kulit 
Perfect 3D Gel;HADA LABO;Rp109.650;Aqua (Water), Butylene Glycol, Arbutin, Niacinamide, PEG-240/HDI Copolymer Bis Decyltetradeceth-20 Ether, Glycerin, Glycosyl Trehalose, Hexylglycerin, Phenoxyethanol, Disodium Succinate, Sodium Metabisulfite, Dextrin, Arginine, Succinic Acid, Hydroxypropyl Trimonium Hyaluronate, Citrus Junos Seed Extract, Hydrolyzed Hyaluronic Acid, Potassium Laurate, Tocopherol, Methylparaben, Sodium Hyaluronate, Sodium Acetylated Hyaluronate (AcHA);4.8;Face Gel;Moisturizer;Melembapkan, mencerahkan, dan anti-penuaan. mengunci kelembapan kulit secara intensif serta menjadikan kulit lebih halus dan lembut. Mencerahkan kulit, menyamarkan noda hitam dan mengurangi kulit kusam. Menyamarkan tanda penuaan dini. Anti oksidan dan menangkal efek radikal bebas. melembapkan kulit.
Premium Cica Aloe Soothing Gel;MISSHA;Rp 92.220 - Rp 159.000;Aloe Barbadensis Leaf Juice (95%), Ethanol, Glacier Water, Saussurea Involucrata Extract, Eggplant Extract, Menthyl Ethylamido Oxalate, Rhodiola Rosea Root Extract, Psidium Guajava Leaf Extract, Cinchona Succirubra Bark Extract, Aloe Barbadensis Leaf Extract, Abronia Villosa Leaf Extract, Polyglutamic Acid, Dioscorea Japonica Root Extract, Aloe Vera Leaf/?Sucrose Ferment Filtrate, Water, Dipropylene Glycol, Allantoin, Glycerin, Chondrus Crispus (Carrageenan) Extract, Sodium Hyaluronate, Cladosiphon Okamuranus Extract, Butylene Glycol, Disodium EDTA, Glyceryl Polyacrylate, C12-14 Hydroxyalkyl Maltitol Ether, Ethylhexylglycerin, Hydrolyzed Corn Starch, Triethanolamine, Carbomer, PEG-60 Hydrogenated Castor Oil, Beta-Glucan, 1,2-Hexanediol, Sucrose, Chlorphenesin, Phenoxyethanol, Fragrance;4.3;Face Gel;Moisturizer;Menenangkan kulit yang iritasi, melembapkan kulit dan menghasilkan kulit yang glowing.
Aloe Vera Gel;EMINA;Rp32.300;Aqua, Butylene Glycol, Beta-Glucan, Triethanolamine, Carbomer, Aloe Vera (Leaf) Extract, Hydroxyacetophenone, Polysorbate 20, Phenoxyethanol, Propylene Glycol, Allantoin, Chlorphenesin, Betaine, Disodium EDTA, Fragrance, Glycerin, Potassium Sorbate, Sodium Benzoate, Sodium Chloride.;4.3;Face Gel;Moisturizer;Menghidrasi kulit dari luar dan dalam, Mampu mengatasi iritasi dan kemerahan
Sekkisei Clear Wellness Water Shield Cream;KOSE;Rp523.160;ITOWA, Job's tears seed extract, lychee extract, glycerin (moisturizer) ITOWA is Alpinia speciosa leaf extract, peony extract, noni juice and glycerin;5;Face Gel;Moisturizer;Melembapkan kulit, membuat kulit halus dan bercahaya, melindungi dari iritasi, menjaga kesehatan kulit, serta meningkatkan ketahanan terhadap gangguan lingkungan
Matcha Biome Oil-Free/Calming Gel Moisturizer;HEIMISH;Rp192.000;Water, Camellia Sinensis Leaf Extract, Glycerin,Butylene Glycol, Dicaprylyl Ether, Niacinamide;0;Face Gel;Moisturizer;menenangkan kulit yang berminyak dan teriritasi. menenangkan kulit sekaligus meningkatan dan menjaga skin barrier. 
Hydration Boost & Calming Lightweight Gel Moisturizer;TERATU BEAUTY;Rp110.000;Aqua, Glycerin, Propylene Glycol, Niacinamide, Aloe Barbadensis Leaf Extract, Allantoin, Artemisia Vulgaris Extract, Camellia Sinensis Leaf Extract, Centella Asiatica Leaf Extract, Butylene Glycol, Caprylic/Capric Triglyceride, Carbomer, Anthemis Nobilis Flower Extract, Deoxyphytantriyl Palmitamide MEA, Hydrogenated Lecithin, Ceramide NP, Cholesterol, Rosa Canina Flower Extract, Phenoxyethanol, Phragmites Karka Extract, Poria Cocos Extract, Chlorphenesin, Tromethamine, Lecithin, Acetyl Glutamine, SH-Oligopeptide-1, SH-Oligopeptide-2, SH-Polypeptide-1, SH-Polypeptide-9, SH-Polypeptide-11, Bacillus/Soybean/Folic Acid Ferment Extract, 1,2-Hexanediol, Caprylyl Glycol, Citric Acid, Potassium Sorbate, Sodium Benzoate, Sodium Hyaluronate.;4;Face Gel;Moisturizer;melembabkan wajah, membantu mencerahkan kulit dan menyamarkan noda hitam. membantu menenangkan kulit wajah. membantu merawat kekenyalan dan skin barrier kulit, serta melembabkan kulit wajah.
Intensive Barrier Brightening Moisturizer;SOULYU;Rp80.550;AQUA, BUTYLENE GLYCOL, GLYCERIN, ALPHA-ARBUTIN, SQUALANE, IMPERATA CYLINDRICA ROOT EXTRACT, CAPRYLOYL GLYCERIN/SEBACIC ACID COPOLYMER, CAPRYLIC/CAPRIC TRIGLYCERIDE, PROPYLHEPTYL CAPRYLATE,DIHEPTYL SUCCINATE, ACRYLATES/C10-30 ALKYL ACRYLATE CROSSPOLYMER, PHENOXYETHANOL, SODIUM HYDROXIDE, FORSYTHIA SUSPENSA FRUIT EXTRACT, PEG-8, CITRUS BERGAMIA PEEL OIL EXPRESSED, CITRUS SINENSIS PEEL OIL, HYDROLYZED HYALURONIC ACID, SODIUM BISULFITE, ETHYLHEXYLGLYCERIN, CARBOMER, 1,2- HEXANEDIOL,SACCHAROMYCES POLYPEPTIDES, GLYCINE MAX POLYPEPTIDE, TOCOPHEROL, ACETYL TETRAPEPTIDE-5, PALMITOYL PENTAPEPTIDE-4, PALMITOYL TRIPEPTIDE-1, PALMITOYL TRIPEPTIDE-5.;0;Face Gel;Moisturizer;berfungsi sebagai perlindungan kulit alami sehingga dapat meningkatkan hidrasi pada kulit secara langsung hingga 24 jam membuat kulit lebih kenyal dan terasa lebih sehat serta cerah merata.
Watermelon Moisture Soothing Gel;HEIMISH;Rp258.000;Water,watermelon extract, glycerin, dimethicone, butylene glycol, phenyltrimethicone,Sorbitol,Moringa seed oil;0;Face Gel;Moisturizer;melembabkan dan menyejukan sehingga dapat membantu menghidrasi kulit dengan mengembalikan keseimbangan hidropolik.
Cica-B5 Soothing Moisturizer;THE ORIGINOTE;Rp52.800;Centella asiatica leaf extract, glycerin, butylene glycol, water, 1,2-hexanediol, hydroxyacetophenone, acrylates/C10-30 alkyl acrylate crosspolymer, triethanolamine, diglycerin, panthenol, propanediol, paeonia suffruticosa root extract, allantoin, adenosine, tremella fuciformis polysaccharide, glycyrrhiza uralensis (licorice) root extract, portulaca oleracea flower/leaf/stem extract, paeonia lactiflora extract, chrysanthemum parthenium (feverfew) extract, camellia sinensis extract, propylene glycol, dianthus chinensis extract, pentylene glycol, artemisia argyi leaf extract, glucose, centella asiatica extract, sodium hyaluronate, caprylhydroxamic acid, maltodextrin, phenoxyethanol, caprylic/capric triglyceride, PEG-40 hydrogenated castor oil, lecithin, magnolol, madecassoside, hydrogenated lecithin, ethylhexylglycerin, asiaticoside, hexylene glycol, stearic acid, cholesterol, ceramide NP, bisabolol, houttuynia cordata extract;5;Face Gel;Moisturizer;menenangkan kulit yang sedang bermasalah seperti kemerahan atau breakout - Menenangkan kulit yang berjerawat, iritasi maupun sensitif - Membantu menenangkan kemerahan pada wajah - Menyegarkan kulit dan menghilangkan minyak berlebih - Membantu mengenyalkan kulit dan menjaga keremajaan kulit 
Acne Care Moisturizer Gel;WHITELAB;Rp65.490;Aqua, Methyl Propanediol, Glycerin, Butylene Glycol, Cyclopentasiloxane, Alumunium Starch Octenyl Succinate, Hydroxyethyl Acrylate/Sodium Acryloyldimethyl Taurate Copolymer, Centella Asiatica (Leaf) Extract, Allantoin, Artemisia Vulgaris Extract, Hamamelis Virginiana (Leaf) Extract, Dipotassium Glycyrrhizate, Salicylic Acid, Saccharide Isomerate, Panthenol, Bisabolol, Zinc Gluconate, o-Cymen-5-ol, Melaleuca Alternifolia Leaf Extract, Bacillus/Folic Acid Ferment Filtrate Extract, Sodium Hyaluronate, Phenoxyethanol, C15-19 Alkane, Lauryl Glucoside, Sodium Acrylate/Sodium Acryloyldimethyl Taurate Copolymer, Triethanolamine, Propylene Glycol, Tetrasodium EDTA, Ethylhexylglycerin, Citric Acid, Sodium Citrate, 1,2-Hexanediol, Sodium Benzoate, Potassium Sorbate.;5;Face Gel;Moisturizer;Menenangkan kulit yang iritasi dan kemerahan akibat jerawat, Mengurangi produksi minyak berlebih, Membantu meningkatkan level hidrasi kulit wajah, Merawat kelembapan dan kehalusan kulit
Hydro Boost Hyaluronic Acid Water Gel;NEUTROGENA;Rp193.630;Water, Dimethicne, Glycerin, Dimethicone/Vinyl Dimethicone Crosspolymer, Phenoxyethanol, Cetearyl Olivate, Polyacrylamide, Sorbitan Olivate, C13-14 Isoparaffin, Dimethicone Crosspolymer, Trehalose, Dimethiconol, Chlorphenesin, Yeast Extract, Carbomer, Sodium Hyaluronate, Ethylhexyglycerin, Fragrance, Laureth-7, C12-14 Pareth-12, Sodium Hydroxide, CI 42090;4.8;Face Gel;Moisturizer;membantu menghidrasi kulitmu, menstimulasinya untuk menghasilkan asam hialuronatnya sendiri dari dalam untuk hidrasi hingga 72 jam, membantu menjadikan kulitmu tampak lebih cerah, terasa kencang dan kenyal, lembut, sehat dan bercahaya.
Aloe-Ha;ROSE ALL DAY;Rp129.000;Water, Aloe Barbadensis Leaf Water, Cucumis Sativus (Cucumber) Fruit Extract, Hyaluronate Acid, Algae Extract, Allantoin, Caffeine, Ascorbic Acid;4.6;Face Gel;Moisturizer;Menyejukkan dan menenangkan kulit, melembabkan kulit, menyembuhkan luka bakar, kulit kering, dan jerawat, menghaluskan kulit, serta mendetoksifikasi dan mengeluarkan racun dari kulit.
Glycolic Acid Gel 10% with Tranexamic Acid;FOR SKINS SAKE;Rp154.800;Aqua, Glycolic Acid, Propylene Glycol, Glycerin, Tranexamic Acid, Biosaccharide Gum-1, Polyacrylate Crosspolymer-11, Phenoxyethanol, Saccharide Isomerate, Hydroxyethylcellulose, Allantoin, Bis- PEG-18 Methyl Ether Dimethyl Silane, Panthenol, Triethylene Glycol, Sodium Hyaluronate, Citric Acid, Sodium Citrate;5;Face Gel;Moisturizer;mengangkat sel-sel kulit mati. menyamarkan garis-garis halus, kerutan, dan mengurangi hiperpigmentasi untuk kulit yang tampak lebih halus, kencang, dan kenyal.
Mandelic Acid Gel 5% with Niacinamide;FOR SKINS SAKE;Rp154.800;Aqua, Mandelic Acid, Propylene Glycol, Glycerin, Niacinamide, Biosaccharide Gum-1, Polyacrylate Crosspolymer-11, Phenoxyethanol, Saccharide Isomerate, Hydroxyethylcellulose, Allantoin, Bis-PEG-18 Methyl Ether Dimethyl Silane, Panthenol, Triethylene Glycol, Sodium Hyaluronate, Citric Acid, Sodium Citrate.;5;Face Gel;Moisturizer;mengatasi jerawat & noda, kemerahan dan mengontrol produksi sebum.
Bio Essence - Bio Water B5 MOIST IN GEL 50;BIO-ESSENCE;Rp293.000;Water, Butylene Glycol, Glycerin, Cyclopentasiloxane, Dimethicone/Vinyl Dimethicone Crosspolymer, Biosaccharide Gum-1, Dimethicone, Dimethiconol, Ammonium Polyacrylate, Pentylene Glycol, Caprylyl Glycol, Menthyl Lactate, PEG-40 Hydrogenated Castor Oil, Vaccinium Macrocarpon (Cranberry) Seed Oil, Olive Oil PEG-7 Esters, 1,2-Hexanediol, Betaine, Sodium Chloride, Methylpropanediol, Allantoin, Sodium Hyaluronate, Hyaluronic Acid, Panthenol, Niacinamide, Euglena Gracilis Extract, Phenoxyethanol, Potassium Sorbate, Tocopherol, Biosaccharide Gum-4, Hexamidine Diisethionate, Tetrasodium EDTA, Fragrance.;4.7;Face Gel;Moisturizer;Memberikan perlindungan pada kulit wajah dari polutan yang menyumbat pori dan  membantu mencegah iritasi. membantu menenangkan kulit wajah, menjaganya  tetap lembab, segar dan terhidrasi.
Ceratinol Moisturizer;THE ORIGINOTE;Rp39.600;Aloe barbadensis leaf water, water, glycerin, butylene glycol, dimethicone, glycosyl trehalose, hydrogenated starch hydrolysate, cyclopentasiloxane, hydroxyacetophenone, allantoin, cetearyl alcohol, PEG/PPG-17/6 copolymer, acrylates/c10-30 alkyl acrylate crosspolymer, cetearyl glucoside, arginine, methylpropanediol, ammonium acryloyldimethyltaurate/VP copolymer, sorbitan olivate, 1,2-hexanediol, glyceryl glucoside, squalane, dimethicone crosspolymer, sodium hyaluronate, polysorbate 80, camellia sinensis extract, sorbitan oleate, stephania tetrandra extract, propylene glycol, caprylic/capric triglyceride, beta-glucan, hydrogenated lecithin, ergothioneine, phospholipids, potassium sorbate, sodium benzoate, hexylene glycol, stearic acid, cholesterol, ceramide NP, retinol, retinal, ceramide EOP, ceramide AS, ceramide NG, ceramide AP, ubiquinone, mannitol, pentylene glycol, hydrolyzed collagen, lycopersicon esculentum extract, nasturtium officinale extract, hydrolyzed rice bran extract, palmitoyl grape seed extract, hydroxypinacolone retinoate, oligopeptide-1, hexapeptide-9, EDTA.;4.3;Face Gel;Moisturizer;membantu dan merawat kulit sehingga terasa kencang, mencegah tanda-tanda penuaan dini, serta merawat keremajaan kulit dan membantu merawat skin barrier wajah. 
24K Symwhite Jelly Booster;THE ORIGINOTE;Rp52.800;Aqua, glycerin, butylene glycol, niacinamide, 1,2-hexanediol, hydroxyacetophenone, acrylates/c10-30 alkyl acrylate crosspolymer, carbomer, PEG/PPG-17/6 copolymer, triethanolamine, methylpropanediol, allantoin, phenylethyl resorcinol, glyceryl glucoside, mica, sodium hyaluronate, stephania tetrandra root extract, propanediol, ergothioneine, centella asiatica extract, pearl extract, mannitol, artemisia argyi leaf extract, caprylhydroxamic acid, hydrolyzed collagen, glutathione, gold, ascorbic acid, glycolic acid, crocus sativus flower extract, diamond powder, tagetes erecta flower extract, oligopeptide-1, hexapeptide-9, EDTA;4.8;Face Gel;Moisturizer;mencerahkan dan meratakan warna kulit. Membantu melembapkan kulit sehingga keremajaan kulit tetap terawat. Mencerahkan kulit, meratakan warna kulit serta mengurangi noda hitam hitam pada kulit, Menghaluskan kulit Membantu mengenyalkan kulit dan menjaga keremajaan kulit
5X Ceramide Barrier Repair Moisturizer Gel;SKINTIFIC;Rp 34.930 - Rp 249.668;AQUA,BUTYLENE GLYCOL,HYDROGENATED POLYISOBUTENE,DIMETHICONE,GLYCERIN,PROPYLENE GLYCOL,1,2-HEXANEDIOL,HYDROXYACETOPHENONE,PEG-400,AMMONIUM ACRYLOYLDIMETHYLTAURATE/VP COPOLYMER,HYDROGENATED LECITHIN,PANTHENOL,PHYTOSTERYL/OCTYLDODECYL LAUROYL GLUTAMATE,CARBOMER,ALLANTOIN,PCA,HYDROXYETHYL ACRYLATE/SODIUM ACRYLOYLDIMETHYL TAURATE COPOLYMER,SQUALANE,CERAMIDE NP,CERAMIDE NS/CERAMIDE NG,CERAMIDE AS,CERAMIDE EOP,CERAMIDE AP,SODIUM HYALURONATE,HYDROLYZED COLLAGEN,CENTELLA ASIATICA EXTRACT,SODIUM HYDROXIDE,HAMAMELIS VIRGINIANA (WITCH HAZEL) EXTRACT,TREHALOSE,ECTOIN,SOPHORA,FLAVESCENS ROOT EXTRACT,OPUNTIA FICUS-INDICA STEM EXTRACT,OPHIOPOGON JAPONICUS ROOT EXTRACT,YEAST POLYSACCHARIDES,PENTYLENE GLYCOL,DISODIUM EDTATOCOPHEROL,POLYSORBATE 60,t-BUTYL ALCOHOL,CITRUS AURANTIUM AMARA (BITTER ORANGE) FLOWER OIL,SORBITAN ISOSTEARATE,CITRUS AURANTIUM BERGAMIA (BERGAMOT) FRUIT OIL,CITRUS MEDICA LIMONUM (LEMON) PEEL OIL;4.8;Face Gel;Moisturizer;Memperbaiki skin barrier, melembapkan kulit, menenangkan sel kulit yang rusak, menghidrasi kulit secara mendalam, cepat menyerap, tidak berminyak, tidak lengket, serta memberikan efek cooling sensation yang menyegarkan kulit.
Aloe 99% Soothing Gel;BRING GREEN;Rp106.080;Aloe Barbadensis Leaf Juice, Glycerin, Arginine, Carbomer, 1,2-Hexanediol, Water, Butylene Glycol, Brassica Oleracea Italica (Broccoli) Extract, Medicago Sativa (Alfalfa) Extract, Brassica Oleracea Capitata (Cabbage) Leaf Extract, Triticum Vulgare (Wheat) Sprout Extract, Brassica Campestris (Rapeseed) Extract, Raphanus Sativus (Radish) Seed Extract.;5;Face Gel;Moisturizer;memberikan hidrasi mendalam pada kulit yang lelah, meminimalkan iritasi kulit.
Acne Treatment Gel;WARDAH;Rp30.500;Aqua, Propylene Glycol, Salicylic Acid, Polyacrylate Crosspolymer-6, Xanthan Gum, Amylopectin, Dextrin, Phenoxyethanol, Capryloyl Glycine, Hexylene Glycol, Butylene Glycol, Sarcosine, Disodium EDTA, Ethylhexylglycerin, Cinnamomum Zeylanicum Bark Extract, Epilobium Angustifolium Extract, Centella Asiatica Extract, Sodium Citrate, Phragmites Kharka Extract, Poria Cocos Extract, Polygonum Cuspidatum Root Extract, Scutellaria Baicalensis Root Extract, Citric Acid, Sodium Benzoate, Camellia Sinensis Leaf Extract, Licorice Root Extract, Chamomilla Recutita Flower Extract, Rosemary Leaf Extract, Sodium Metabisulfite;4;Face Gel;Moisturizer;Mengempeskan jerawat dengan cepat, mencegah pertumbuhan bakteri penyebab jerawat, mencegah iritasi, mengatasi peradangan, membantu proses pengelupasan, dan mengeringkan jerawat.
