name;brand;price;ingredients;rating;sub-category;category;benefit
MSH Niacinamide Brightening Moisture Gel;SKINTIFIC;Rp 34.930 - Rp 248.918;WATER, BUTYLENE GLYCOL, ISONONYL ISONONANOATE, GLYCERIN, NIACINAMIDE, CERAMIDE EOP, CERAMIDE NS/CERAMIDE NG, UNDECYLENOYL PHENYLALANINE(MSH)ÔºåCENTELLA ASIATICA EXTRACT, ALPHA ARBUTIN, CERAMIDE NP, TRANEXAMIC ACID, CERAMIDE AS, CERAMIDE AP, LIMNANTHES ALBA (MEADOWFOAM) SEED OIL, BETAINE, JOJOBA ESTERS, HYDROXYACETOPHENONE, PANTHENOL, 1,2-HEXANEDIOL, CETEARYL OLIVATE, CYCLOHEXASILOXANE, SORBITAN OLIVATE, BIS-PEG/PPG-20/5 PEG/PPG-20/5 DIMETHICONE, METHOXY PEG/PPG-25/4 DIMETHICONE, ACRYLATES/C10-30 ALKYL ACRYLATE CROSSPOLYMER, DIMETHICONE/VINYL DIMETHICONE CROSSPOLYMER, ARMILLARIA MATSUTAKE EXTRACT, PENTYLENE GLYCOL, SACCHAROMYCES CEREVISIAE EXTRACT;4.8;Face Gel;Moisturizer;Mencerahkan kulit dalam 14 hari, mengontrol minyak selama 24 jam, menyerap dengan cepat, menyejukkan kulit yang teriritasi ringan, merawat elastisitas kulit, menenangkan kulit, serta memperbaiki dan menjaga skin barrier.
YADAH Cactus Soothing Gel;YADAH;Rp 84.150 - Rp 153.850;Opuntia Ficus-Indica Stem Extract, 1,2-Hexanediol, Glycerin, Butylene Glycol, Dipotassium Glycyrrhizate, Panthenol, Allantoin, Carbomer, Arginine, Disodium EDTA, Dipropylene Glycol, Hydroxyacetophenone, Caprylyl Glycol.;4.5;Face Gel;Moisturizer;Merawat kulit wajah dan seluruh tubuh agar tetap halus, lembut, dan terjaga kelembapannya. membantu memberikan efek nyaman yang menyejukkan. merawat kulit agar tetap lembap.
Matcha Glow Dream Mask;DORSKIN;Rp98.040;Aqua, Xanthan Gum, Propylene Glycol, Aloe Vera Leaf Extract, Butylene Glycol, Glycerin, Isonony≈Ç Isononanoate, Paraffinum Liquidum, Centella Asiatica Leaf Extract, Ethyl Macadamiate, Arbutin, Polyacrylamide, C13-14 Isoparaffin, Laureth-7, Cetyl Alcohol, Cetearyl Alcohol, Glyceryl Stearate, PEG-40 Stearate, Ceteareth-20, Phenoxyethanol, Fragrance, Camellia Sinensis Leaf Extract, Ci 19140, Ci 42090, Ci 73015;5;Face Gel;Moisturizer;Membantu melindungi kulit dari dampak radikal bebas, Membantu menjaga skin barrier kamu, Membantu melembabkan kulit, Membantu mencerahkan wajah, Membantu menenangkan kulit kemerahan dan mengurangi noda bekas jerawat, Membantu menutrisi kulit agar lembab dan kenyal
Dreamy Glow Postbiotic Gel Mask;BASE;Rp161.100;Water, Butylene Glycol, Glycerin, Cetearyl Alcohol, Propanediol, Ammonium Acryloyldimethyltaurate/VP Copolymer, Butyrospermum Parkii (Shea) Butter, Rosa Damascena Flower Water, 1,2-Hexanediol, Caprylic/Capric Triglyceride, Caprylhydroxamic Acid, Lactobacillus Ferment, Panicum Miliaceum(Millet) Seed Extract, Disodium EDTA, Deoxyphytantriyl Palmitamide MEA, Hydrogenated Lecithin, Ceramide NP, Cholesterol, Potassium Sorbate, Sodium Benzoate;5;Face Gel;Moisturizer;menghidrasi kulit secara mendalam, menyejukkan kulit, serta merawat kulit agar tetap halus dan lembut. mengistirahatkan kulitmu yang kusam, lelah, dan dehidrasi. Melembapkan secara intensif, memperbaiki skin barrier, dan merawat kulit sepanjang malam untukmu bangun dengan kulit lembut dan glowing. - meningkatkan hidrasi kulit, meningkatkan hidrasi kulit, kelembapan untuk kulit sehat dan kenyal.
Aloe 99% Soothing Gel (Fresh Moisturizing);HOLIKA HOLIKA;Rp 58.500 - Rp 135.200;Aloe Barbadensis Leaf Juice, Nelumbium Speciosum Flower Extract, Centella Asiatica Extract, Bambusa Vulgaris Extract, Cucumis Sativus (Cucumber) Fruit Extract, Zea Mays (Corn) Leaf Extract, Brassica Oleracea Capitata (Cabbage) Leaf Extract, Citrullus Lanatus (Watermelon) Fruit Extract, Peg-60 Hydrogenated Castor Oil, Sodium Polyacrylate, Carbomer, Triethanolamine, Fragrance, Phenoxyethanol;4;Face Gel;Moisturizer;memberikan hasil yang lebih maksimal. Pemulihan luka, menenangkan, menurunkan temperatur kulit dan melembabkan, menenangkan, pelindung melawan stres pada kulit 
3X Acid Anti-Acne Gel Moisturizer;SKINTIFIC;Rp115.650;AQUA, BUTYLENE GLYCOL, DIMETHICONE/VINYL DIMETHICONE CROSSPOLYMER, CYCLOPENTASILOXANE, TREHALOSE, PANTHENOL, LACTOBIONIC ACID, LACTIC ACID, GLYCERIN, CYCLOHEXASILOXANE, 1,2-HEXANEDIOL, HYDROXYACETOPHENONE, CARBOMER, METHYL GLUCETH-20, SALICYLIC ACID, SOPHORA FLAVESCENS ROOT EXTRACT, AMMONIUM ACRYLOYLDIMETHYLTAURATE/VP COPOLYMER, PENTYLENE GLYCOL, OPHIOPOGON JAPONICUS ROOT EXTRACT, OPUNTIA FICUS-INDICA STEM EXTRACT, PORTULACA OLERACEA EXTRACT, TRIBULUS TERRESTRIS FRUIT EXTRACT, SODIUM HYDROXIDE, DISODIUM EDTA, 10-HYDROXYDECANOIC ACID, ARGININE/LYSINE POLYPEPTIDE, ECTOIN, PEG-40 HYDROGENATED CASTOR OIL, CORNUS OFFICINALIS FRUIT EXTRACT, AROMA, CI 42090, MALTODEXTRIN, ACACIA SENEGAL GUM, CENTELLA ASIATICA LEAF EXTRACT, GLYCOLIC ACID, SODIUM MAGNESIUM SILICATE, CITRIC ACID, XANTHAN GUM.;3.8;Face Gel;Moisturizer;Meredakan kemerahan, rasa perih, dan sakit pada jerawat, mengeringkan jerawat, meratakan (flatten) jerawat, mencegah munculnya jerawat baru, meminimalkan jerawat yang muncul kembali, membantu menyamarkan bekas jerawat (PIE/PIH), mengontrol produksi minyak berlebih, serta meningkatkan kesehatan skin barrier pasca jerawat.
Centella Gel;BENTON;Rp156.000;Centella Asiatica Extract (80%), Aqua (Water), Glycerin, Pentylene Glycol, Arginine, Ammonium Acryloyldimethyltaurate/VP Copolymer, Acrylates/C10-30 Alkyl Acrylate Crosspolymer, Sodium Gluconate, Chamaecyparis Obtusa Water, Propanediol, Butylene Glycol, Enantia Chlorantha Bark Extract, Oleanolic Acid, 1,2-Hexanediol, Dipotassium Glycyrrhizate, Melaleuca Alternifolia (Tea Tree) Leaf Extract, Portulaca Oleracea Extract, Houttuynia Cordata Extract, Asiatic Acid, Madecassic Acid, Asiaticoside, Madecassoside, Caprylic/Capric Triglyceride, Hydrogenated phosphatidylcholine, Sucrose Stearate, Cetearyl Alcohol;5;Face Gel;Moisturizer;menenangkan dan meredakan kemerahan kulit dengan cepat, sekaligus melembapkan kulit kering dan sensitif dengan ringan, Merevitalisasi kulit kusam dan mengatur keseimbangan minyak-air, membuat kulit tidak berminyak namun dengan hasil akhir yang menghidrasi.
5% Niacinamide HydraMoist Gel;SCORA;Rp59.120;Aqua. Niacinamide. Butylene Glycol, Lactobecily/ Collagen/Mesembryanthemum Crystallinum Leo Extract Ferment Lysate, Siloxanetriol Alginate, Glycerin, Hamamelis Virginiana Extract, Gluconobacter/Honey Ferment Filtrate, Paeonia Albiflora Flower Extract, BIS-PEG-15 Methyl Ether Dimethicone, Lactobacillus/Hydrolyzed Collagen Ferment Filtrate Extract, Carbomer, Triethanolamine, Phenoxyethanol, DMDM Hydantoin, Polyglutamic Acid, Caffeine, Disodium EDTA, 1,2-Hexanediol, Sodium Hyaluronate, Hydrolyzed Hyaluronic Acid, Hydroxypropyltrimonium Hyaluronate, Ethylhexylglycerin, Bee Venom, Sodium Acetylated Hyaluronate, Arginine, Phytic Acid, Silver Oxide.;5;Face Gel;Moisturizer;Melembabkan - Membantu mencerahkan kulit - Perfecting make up - Membantu memperbaiki skin barrier - Menenangkan kemerahan dan inflamasi - Non-comedogenic
